{
  "benchmark": "benchmark_v1",
  "scene_file": "benchmark_v1.tnhpp",
  "rays": 500000000,
  "seed": 123456789,
  "worker_count": 20,
  "chunk_size": 10000,
  "target_side_id": 1,
  "target_bounds": {
    "x_min": -2.0,
    "x_max": 2.0,
    "y_min": -2.0,
    "y_max": 2.0
  },
  "target_grid": {
    "width": 100,
    "height": 100
  },
  "photon_export": false,
  "output_file": "benchmark_result.json",
  "flux_grid_output_file": "benchmark_flux_grid.csv"
}
